source_db,old_paper_id,old_title,new_paper_id
db2,265,"Εξέταση των εκπαιδευτικών δυνατοτήτων  και των αναγκών των Σχολικών Μονάδων Ειδικής Αγωγής της Περιφέρειας Κρήτης, Παραδοτέο Ι, Μέρος Β: Ανάλυση των αποτελεσμάτων",23f9e5ca-2086-5d0d-aeff-026fab6c6bcd
db2,266,"Εξέταση των εκπαιδευτικών δυνατοτήτων και αναγκών των Σχολικών Μονάδων Ειδικής Αγωγής της Περιφέρειας Κρήτης: Παραδοτέο Ι, Μέρος Γ: Περίληψη",166f2cec-9905-520f-8a5b-11827fa832b4
db2,267,Hardware and Software specifications of adapted terminal emulators for PSN,c5a674c1-2032-5dea-9f51-363fd9f2c2c0
db2,268,Two terminal emulators and relevant documentation,d9ba5758-4cb4-5cd0-956a-93342f18e6ff
db2,269,Hardware and Software specifications of the terminal emulator,e5b77a0d-ad9c-55e0-bd74-8a833bb2d195
db2,270,Ετήσια έκθεση προόδου εργασιών έτους 1992 για το πρόγραμμα HORIZON,ebd73e56-7146-58df-8eaf-2bf9c863705f
db2,271,Models of selected areas/segments within the Rehabiliatation Technology market,e5161f76-a1f5-520c-990e-0f02debeca4f
db2,272,A global scheme for na Information System for the Rehabilitation technology market,ad0ba03e-77f8-516e-a3fe-adb434b78473
db2,273,"Definition of strategies for data collection, processing and dissemination",dc993ea7-adce-5377-bf5a-623394e7604e
db2,274,Investigation of multimedia UIMS architectures with respect to blind people,86b27c1a-8cd4-5b3c-97a0-b63375e03fa4
db2,275,Draft Report on the X-Windows demonstrator,4b2db359-32d2-51d4-8b93-9889910f8031
db2,276,Report on the development of run-time module,dabfb685-7be3-51bd-8e64-ba613d847cd4
db2,277,Models of selected areas/segments within the Rehabilitation Technology market,e1517691-ee18-5ddb-bda1-d5e8374947cf
db2,278,Analysis of Textual and Graphical User Interfaces,e7ee5a5f-6f7c-54fc-912e-7892a7d1e4d7
db2,279,Analysis of Textual and Graphical User Interfaces,2da611ac-3ef4-5907-a23c-eb44de0d7921
db2,280,Preliminary Report on the development of the run-time module,aa674e1c-d6cb-57b4-a1e2-4de71ecf1d7a
db2,281,WP 1.3: Definition of the functionality of Multimedia Interfaces,0c90904f-54d8-5b36-a5ea-447725802435
db2,282,Multimedia exchanges of information of  PSN,275e3e88-ed0c-57d1-a1cb-2f6773ad4c8b
db2,283,"Ετήσια έκθεση προόδου εργασιών, έτους 1992 για την ανάπτυξη και λειτουργία του Συστήματος HANDYNET στην Ελλάδα",d2caaaf0-9362-528e-aea4-3babca00f474
db2,284,WP 1.1: Report on adaptations of B-ISDN services and applications,fc03c7be-cfe5-5b1e-969a-a8b31326bdeb
db2,285,Ετήσια έκθεση προόδου εργασιών έτους 1991 σχετικά με την ανάπτυξη και λειτουργία του Συστήματος HANDYNET στην Ελλάδα,4de49895-e66c-5a24-a1b9-89f2f8bc23c7
db2,286,WP 4: IBC Terminal Functional Specifications,a05b62bc-3023-5c7c-83f8-97ccb2030843
db2,287,Wp 4: User Tasks in a Multi-Media environment,5a1a99c5-d31d-5817-8beb-ed3a89ae759d
db2,288,WP 4: Sumulation of the interaction of various people with Special needs user groups with selected examples of foreseen services,ff11c166-3b01-52a6-b477-dde840e682b4
db2,289,WP 4: Special Application and Special Services for People with Special Needs,04a3b39f-6edd-520e-abc5-f3601f6ceabc
db2,290,"Telecommunications Facilities for people with Special needs, Volume 1: Evaluation of the Standardisation Situation and Recommendations for Further Standardisation Activities",58ddfafa-e8c6-58ee-bdd8-41c84d5293b7
db2,291,"Telecommunications Facilities for people with special needs, Volume 2: PT6V Data base and Matrix Sheets",0411b395-c06a-54ec-a2fb-90581c5567ff
db2,292,TIDE Market Survey Report,e651aad5-b901-5aa3-a706-07904c59f067
db2,293,"Telecommunications Facilities for People with Special Needs, Stage 1: Standardisation Situation in Europe",cc2464a8-c759-5ac0-b446-d02fd32ea8d6
db2,294,"Ετήσια έκθεση προόδου εργασιών, έτους 1990, σχετικά με την ανάπτυξη και λειτουργία του Συστήματος HANDYNET στην Ελλάδα",8f6f8472-c611-5c81-bb05-dac12eba260e
db2,295,WP 3: IBC Terminal Functional specifications,7d9d2309-d0ec-5829-a5ab-b635fe39e42b
db2,296,WP 2.1: state of the Art solutions of a model IBC Terminal for users with Special Needs,a6d1664d-0cda-562c-aa36-f7b9f3af33b8
db2,297,WP 2.2: Potential solutions for accessibility of IBC Terminals for PSN Users,f5934016-f8a2-5f79-8209-51806ed4524a
db2,298,"Ετήσια έκθεση προόδου εργασιών, έτους 1989, σχετικά με την ανάπτυξη και λειτουργία του Συστήματος HANDYNET στην Ελλάδα",5bdf39c7-ecba-5525-88ac-0fe4490a8317
db2,299,WP 2.3: Initial IBC Terminal Design Guidelines in favour of users with Special needs,a1a747bd-bac5-5752-af8b-e6f5a3e3a24b
db2,300,WP 1: Collection of IBC Criteria,e33fa832-25d9-59f6-95f7-c40067d9b99c
db2,301,Multiple Metaphor Environments: Issues for effective human interface design,8b82a6fe-c37d-5f10-a5f9-6935481661cc
db2,304,"3rd ERCIM Workshop on ""User Interfaces for All""",994ba1de-7c4c-5594-8075-b257967d18db
db2,305,"1st ERCIM Workshop on ""Towards User Interfaces for All: Current efforts and future trends""",edf96da8-7d0f-53b1-8b8f-4af3b515910d
db2,307,Πρόσβαση Ατόμων με Ειδικές Ανάγκες στην Κοινωνία της Πληροφορίας: Ευρωπαϊκή Τράπεζα Πληροφοριών για Θέματα Αποκατάστασης,3de9a3e0-e508-5ce4-bf5c-d925866a3246
db2,308,`Εργο ΕΣΤΙΑ: Επαγγελματική Κατάρτιση Ατόμων με Ειδικές Ανάγκες σε Περιβάλλοντα Εργασίας όπου χρησιμοποιούνται υπολογιστές,9a18abb9-de4f-5c5a-829b-b57b71695bda
db2,310,"User Interfaces for All - Concepts, Methods, and Tools",88a4652d-9b89-5218-a98e-98f8da81be48
db2,311,Towards an Information Society for All: An International R & D Agenda,be8ec7cb-e8f5-567a-a8c6-381f18f3de91
db2,314,Design for All in HCI,6aa75563-8e5f-5e42-8189-cc76be5703ff
db2,317,Towards an Information Society for All: Some Critical Issues,f8344d0d-735f-5643-a479-8d215a3c9c60
db2,319,TIDE ACCESS TP1001: Development Platform for Unified Access to Enabling Environments,054ac851-beaf-5056-bbf0-aa29919ad050
db2,320,Agents Classes for Managing Dialogue Control Specification Complexity,5ba8391c-63b9-550e-8112-97ce6efa185f
db2,321,"PIM: A Tool for Building Programming Layers on Top of Toolkits, 10 pages.",3e495e83-448f-5537-b0ce-e78f907b3a2b
db2,415,Adaptable and Adaptive User Interfaces for Disabled Users in AVANTI Project,6455f4d8-8ecd-5f03-bd17-c9baec3f6753
db2,419,Support for Iterative User Interface Prototyping: The Sherlock Guideline Management System,2e24ba7b-f516-5a4f-a491-60ccc5296765
db2,420,Designing User Interfaces for All,a85b0560-6edc-5bef-88d8-39f1d375b48d
db2,421,User Interface Final Development,d4349796-8dd3-5ee1-9e7b-da90b2fae0c8
db2,422,Media/Modalities Allocation in intelligent Multimedia User Interfaces: Towards a Theory of Media and Modalities,aeb7aef6-a524-53ca-a891-6137be6693c1
db2,423,Access to Lexical Knowledge in Modular Interpersonal Communication Aids,1529583b-0e53-51f0-9984-ee1831346f88
db2,424,Design for All in the TIDE ACCESS project,101d63c0-87ff-58dc-abea-10905da3a870
db2,425,Knowledge-based Interaction Design,0d74f0cc-2e2c-582e-a5da-be8bdd1a5321
db2,432,User Adapted Interaction on the Web,8e578ef8-036b-57a0-817a-76863941ef88
db2,433,Adaptation of Services for Different Users: The User Interface,7779692d-f777-521d-866d-857419a17e5c
db2,434,Adaptable and Adaptive User Interfaces,2160c6a0-ffb0-5c40-ba5c-8da6f6f9b2a4
db2,435,Προς μία Κοινωνία της Πληροφορίας για `Ολους,15dffd40-3661-59b3-80d1-6551f0c74428
db2,436,`Ισες Ευκαιρίες για `Ολους στην Κοινωνία της Πληροφορίας,563b88c4-e213-5292-b61a-ec7e9cc70132
db2,437,Προοπτικές `Ενταξης των ΑΜΕΑ στην Κοινωνία της Πληροφορίας,737adac2-c255-56cb-bdfc-fc9af34abed0
db2,438,Πρόσβαση των Ατόμων με Ειδικές Ανάγκες στον Παγκόσμιο Ιστό,e09d1acd-e216-5833-a940-037fdfbceb60
db2,439,Towards an Information Society for All: New Opportunities and Challenges,a6288a94-f7b1-5f7a-9935-f9344c751e3d
db2,440,"Adaptable and Adaptive Information Access for All Users, Including Disabled and Elderly People",23ebf72c-737d-54f8-b4dc-ba6bba2b0946
db2,442,User Interaction in Digital Libraries: Coping with Diversity through Adaptation,8f3a9e48-5600-589a-8d1e-ee5d8923d883
db2,443,User Interaction in Digital Libraries: Coping with Diversity through Adaptation,8f3a9e48-5600-589a-8d1e-ee5d8923d883
db2,448,2nd European Conference on Research and Advanced Technology for Digital Libraries (ECDL '98),28941a5b-38d4-55c2-8418-1d92866d5b08
db2,449,Proceedings of the 2nd European Conference on Research and Advanced Technology for Digital Libraries (ECDL '98),ce3f827b-218e-551e-be5f-47fda2da9a3a
db2,451,Developing an Accessible Information Society,adb40e36-2e15-5799-af6d-d60becb0ca45
db2,453,Accessibility & Standardisation in the TIDE-WAI Project,2fad84d7-feab-5b89-b690-fda88f0b6a1d
db2,454,Προς μία Κοινωνία της Πληροφορίας για `Ολους: Νέες Ευκαιρίες και Προκλήσεις,97af7248-c0f2-5aa3-aeb1-728cd45df8cf
db2,455,Επαγγελματική Κατάρτιση Ατόμων με Ειδικές Ανάγκες σε Περιβάλλοντα Εργασίας όπου Χρησιμοποιούνται Υπολογιστές,95afb31b-e426-5b4c-a27c-6c4d23e48a03
db2,456,Εφαρμογές Πρόσβασης Ατόμων με Ειδικές Ανάγκες σε Υπολογιστικά Περιβάλλοντα,83b97656-4b31-53cc-b7e0-961a749abec8
db2,457,Forms for the Collection of User Requirements,be497442-a384-5952-a3da-d89e742eaf17
db2,458,"2nd ERCIM Workshop on ""Towards User Interfaces for All""",85122390-345b-5448-926b-369c0740e849
db2,459,2nd European Conference on Research and Advanced Technology for Digital Libraries (ECDL '98),d849440b-a103-55e1-b908-d4d8336d87e8
db2,461,Focusing on an international R&D agenda for Universal Accessibility: Reflections from the 2nd ISF workshop,6d4d1594-2672-5d71-948e-069527f34fab
db2,463,Self-Adapting Web-based Systems: Towards Universal Accessibility,30383b2d-f592-5d5f-98e2-67a1667b281a
db2,464,Universal accessibility in HCI: Press-oriented design guidelines and tool requirements,29ba9b45-d8f8-566a-b091-f5fb2d473bc1
db2,465,"A report on the second meeting and workshop of the International Scientific Forum ""Towards an Information Society for all""",6d4a2448-2bcb-556d-9ea8-07c7311e5d1b
db2,466,Universal accessibility in HCI: Process-oriented design guidelines and tool requirements,44de9dcb-bcbc-569a-b1ea-1fdefd5848bb
db2,467,"Report on the Second Meeting  and Workshop of the International Scientific Forum ""Towards an Information Society for All""",959d7b59-b773-5315-88ee-351e28e0df29
db2,468,"Demonstration of the AVANTI browser, focusing on the employment of adaptability and adaptivity techniques for the provision of universal accessibility",6bed67d6-c9b4-5ad6-a272-ddde1e05d486
db2,469,"Demonstration of the AVANTI browser, the I-GET UIMS Tool, the USE-IT Tool, and the Unified User Interface Development Environment",0dd3b3fe-262d-57ea-aec9-14f752efad09
db2,470,Demonstration of the AVANTI browser,875d77cc-c717-5657-b4a6-764946ff962b
db2,471,Demonstration of the AVANTI Information System running the AVANTI Browser,44ad18e6-edc0-5613-955d-d7f194247339
db2,472,Demonstration of the AVANTI Browser,875d77cc-c717-5657-b4a6-764946ff962b
db2,473,Demonstration of the AVANTI browser,875d77cc-c717-5657-b4a6-764946ff962b
db2,474,Demonstration of the AVANTI Browser,875d77cc-c717-5657-b4a6-764946ff962b
db2,475,"Demonstration of the AVANTI Browser, the I-GET UIMS Tool, the USE-IT Tool, and the Unified User Interface Development Environment",3ae50554-a025-568f-8923-8198871f83b2
db2,476,Demonstration of the AVANTI Browser,c4bae65f-cc42-502a-a3ce-76f53767af48
db2,477,Demonstration of Adaptation of Services for Different users,4e39ba82-bc2d-5eee-b6f2-2f3b711c54a0
db2,478,Diversity in Large Information Spaces: User Interface Software in Technology Issues,41fc4012-9fe0-50d5-905a-8d1650892473
db2,479,"Proceedings of the 4th ERCIM Workshop on ""User Interfaces for All""",ab33e273-c3eb-57eb-89e1-07a62602f6c4
db2,480,"4th ERCIM Workshop on ""User Interfaces for All""",63aac615-3536-5dbd-aa38-49f0ab857425
db2,481,Interaction Design in Digital Libraries: Some critical issues,7c8e9da2-8525-57ef-9463-634ef9525491
db2,483,Πρόγραμμα HORIZON - Έργο ΕΣΤΙΑ: Καινοτομίες Τεχνολογιών Πληροφορικής στην Επαγγελματική Εκπαίδευση και Απασχόληση ΑΜΕΑ,0b1ada7f-63d6-5601-a67a-875175097c96
db2,484,Toward an Information Society for All: HCI challenges and R&D recommendations,41bbedd7-affa-52eb-8406-1789c97f6b1c
db2,485,Computational Environments for Human Factors Knowledge Management in HCI Design,2b12ffef-ebbf-5534-826d-ae0205c85235
db2,486,Managing Accessibility Guidelines during User Interface Design,fc312d4d-8980-51a0-a4b8-c51f2f65cbe2
db2,487,Connecting to the Information Society: A European Perspective,11711387-b3e5-54ab-9651-2a1d5319c733
db2,489,Distance Learning,a002714c-2dc8-5df3-a51b-a5e603e60d2b
db2,490,Multiple Metaphor Environments: issues for effective interaction design,b1a8aba2-9851-535e-8b7e-cb7cff671d61
db2,491,Direct Accessibility for People with Disabilities,37bfa389-693b-5faa-887f-a9bc6a907ec7
db2,493,Information Society and the Citizen,91e8bcca-4405-53f8-8fd1-d0ef678a5bab
db2,494,Vocational Training of Disabled People in Computer-based Working Environments,e05a034c-94a1-5314-af3f-354659025b3a
db2,495,4th ERCIM Workshop on User Interfaces for All,77b2725c-a16d-5cc8-b53a-98b1a0d413ee
db2,496,ERCIM DELOS - User Interfaces for All Joint Workshop,6ea03cb2-495c-5ab4-889e-8411f22cdf6c
db2,497,User Interaction in Digital Libraries: Copying with Diversity through Adaptation,5b4efeb2-7589-5f08-9cbe-28484805ebfd
db2,498,Universal Access in the Information Society,b80f0260-73cb-5b98-8518-3628d7a773f2
db2,500,Unified User Interfaces: From design to implementation,0a1cca33-84cd-5bd9-ab28-d9f954e01aaa
db2,501,Universal accessibility on the Web: Process-oriented design guidelines,1e01d549-4f2e-5d89-901a-0efc65bd4d5e
db2,502,Non-Visual Web browsing: Lessons learned from the AVANTI case study,04b84bc5-106f-5d96-b4bd-c34d96c4fe7e
db2,503,Non-visual Web browsing: Lessons learned from the ANANTI case study,2d163673-1d22-56f5-994d-d0b92fa58fdc
db2,504,A grammar-based approach for populating HCI design spacesl,58cee0fc-5981-57ff-ac36-0d67c19aa48d
db2,505,Embedding HCI guideline input to iterative user interface development,e187c23a-8a6f-5392-8dcd-c83293c193fc
db2,506,Universal Design in the Information Society: A utopia or a challenge?,a4531398-974d-5e5b-b965-8c96a6df271b
db2,507,Coping With Diversity In HCI: Techniques For Adaptable and Adaptive Interaction,88a63848-1b94-554d-a4ca-5299ae477f77
db2,508,Report of the Strategic Requirements Board,1c7a3ecd-2edd-5fb7-a3d8-d8012755b413
db2,509,Designing for Interaction Quality in Health Telematics,c4852e0f-b0ec-5790-b95e-9574ed6f3a72
db2,511,Universal Design in HCI,62f760de-9f7f-56a0-895b-73b57645b5e4
db2,513,Policy perspectives on Design for All,6a5f3280-46d4-567c-85ef-32406ff9591a
db2,514,Embedding HCI guideline input to iterative user interface development,e187c23a-8a6f-5392-8dcd-c83293c193fc
db2,515,Diversity in Large Information Spaces:User Interface Software and Technology Issues,8838a410-5f78-5a9f-a177-8254ab31ee83
db2,516,User Interactionin in Digital  Libraries: Coping with Diversity through Adaptation,7919be9a-b351-5a9b-8d45-07510bc77188
db2,517,Standardisation guidelines for the accessibility of Web-based applications and services by people with disabilities,04c8d0f1-c038-5cd3-a8f4-47042785c6fd
db2,518,Draft report on standardisation guidelines for the accessibility of Web-based applications and services by people with disabilities,2365b498-8f42-5a68-8cee-e7b9d3ae459a
db2,519,Report on data collection methods and data analysis,e3a05a1d-7f46-5593-88dc-59f800837635
db2,520,Accessing the Information Society,453e8042-c489-5d5e-b0ff-ecedff53ca36
db2,521,Persistent Ergonomic Knowledge Management in HCI Design,1a577f97-3366-51b1-83ef-7a2de1b65cd6
db2,523,Accessibility guidelines and scope of formative HCI design input: Contrasting two perspectives,38592d2e-a6ae-576c-8cc6-9fafba4769c9
db2,524,Evaluating adaptable and adaptive user interfaces: lessons learned from the development of the AVANTI Web browser,f47176bf-e4e5-5a34-ac5c-a9b077358ce6
db2,525,Universal Access & Distance Learning in the Information Age,16b93be4-089c-598d-8a70-2d6c8e5b21f0
db2,526,Designing for all in the Information Society: Challenges towards universal access in the information age,4453e5e1-5350-5585-bad7-4340a68c87a4
db2,527,Proceedings of the 5th ERCIM Workshop on User Interfaces for All,be685235-390a-5888-897d-c7c87cf50d26
db2,528,5th ERCIM Workshop on User Interfaces for All,81853ec3-c4de-56f8-80e1-a4cba0ef2906
db2,529,"Proceedings of the ERCIM WG UI4ALL  on ""Interactive Learning Environments for Children""",5247200a-d6c4-5a29-bf60-1a57a607cfc5
db2,530,"ERCIM WG UI4ALL one-day joint workshop with i3 Spring Days 2000 on ""Interactive Learning Environments for Children""",93c5fb92-4efa-5b43-9327-8bbee946df29
db2,531,Knowledge-based Interaction Design,aa6b0dca-1020-5ab3-af81-03e8ba274b67
db2,532,A model-based approach to the specification of computer-based communication aids,cd9198ef-f6e1-5cb3-9f63-3175c6fa4d46
db2,533,Adaptive techniques for Universal Access,ce75c195-5c4b-5ee1-88cf-5e1a6605f4b8
db2,534,Universal Access through Unified User Interfaces,db33b879-5712-5d91-a9b3-6abb02c829b1
db2,535,Web-Based Information Systems for People with Disabilities: THE EC AVANTI PROJECT,1ca5bf6e-4202-535c-9f7b-30d3eb5e758b
db2,536,Multiple Metaphor Environments: Architectural premises for continuous interactions,2784027d-7f73-5388-b98f-669f0034231a
db2,537,Designing the User Interface of an Interactive Learning Environment for Children,49792f13-8fea-5b09-ac98-f04b7ef28e89
db2,538,Children in the Information Society: addressing tomorrow's Unified Environments of Use.,a1ac4cf6-45ce-53f2-9327-815a48787eb3
db2,539,The GRAFIS Word processor for People with Disabilities,461665a5-6a54-5643-9bd7-5bdee402f9a5
db2,540,User Interfaces for All,6bec752a-4dbe-51cb-a124-c511ee5bd353
db2,541,"5th ERCIM Workshop on 'User Interfaces for All""",49c2a1b5-92b0-50f1-86b9-b3194dc5e56e
db2,542,Challenges towards Universal Access in the Information Age,9d0069bf-b2fb-5426-bc77-e6712c132102
db2,543,Adaptive Browsing: Supporting All Users on the Web,b7d23da5-f123-51a1-9a81-b193a6f13a03
db2,544,"Demonstration of the AVANTI Browser, Focusing on the employment of adaptability and adaptivity techniques for the provision of Universal accessibility",19fc1791-1ff8-553e-9786-5e5a4f0f4911
db2,545,Αναφορά στο πλάνο αξιολόγησης του συστήματος,56e514ee-4fdd-54ea-8923-8a86ace3c546
db2,546,Αναφορά στις απαιτήσεις του ενοποιημένου συστήματος πλοήγησης στον Παγκόσμιο Ιστό για τις διαφορετικές κατηγορίες χρηστών,cb017c9b-6421-50ed-93e6-e618fb60c6cc
db2,547,Αναφορά στις απαιτήσεις του ενοποιημένου συστήματος πλοήγησης στον Παγκόσμιο Ιστό για τις διαφορετικές κατηγορίες χρηστών,cb017c9b-6421-50ed-93e6-e618fb60c6cc
db2,548,"Report on the Third Meeting and Workshop of the International Scientific Forum ""Towards an Information Society for All""",57807e85-8eaf-5926-a73e-c63e8b5df2ae
db2,549,Sherlock: A Tool Towards Computer-Aided Usability Inspection,23e46450-95e8-50f5-ad9a-1ca9f914a2d1
db2,550,Designing for All in the information Society: Challenges Towards Usniversal Access in the Information Age,90cd6e94-d11a-5028-a5f0-ce78eb98dd64
db2,551,"Design for ""all"" in the Information Society",6165091e-f510-5ea4-81d0-6edebdf3a5ef
db2,553,Technological Challenges within an Information Society for All Citizens,c9b4b0f1-03b5-5e4a-9e84-ba8a65c72162
db2,554,"Summary Update on ""Universal Design in the Information Society""",4b0a1205-e9e7-580f-ae02-2ecc554f2077
db2,555,IS4ALL: A new Working Group promoting universal design in Information Society Technologies,3a5998d9-9df3-5d58-b0a5-f2b8232cb78f
db2,556,IS4ALL: A new Wprking Group promoting universal design in Information Society Technologies,d0749d8c-b44b-5ba6-9806-df4303a92d77
db2,557,Adaptive techniques for unversal access,33a9710f-9b31-5982-8b34-e822fbbd4d41
db2,558,Proceedings of the 6th ERCIM Workshop on User Interfaces for All,a41937bd-cf5e-57f8-b15b-6100595188bd
db2,559,Αναφορά στο σχεδιασμό και την ανάπτυξη πρωτοτύπων της ενοποιημένης διεπιφάνειας χρήσης του συστήματος,137800e2-a90d-554d-bdc5-e998f26233fb
db2,560,Αναφορά στο σχεδιασμό του λειτουργικού κορμού του συστήματος,dc62148b-6795-56a6-ac1c-20c8b0bf4d0e
db2,561,"6th ERCIM Workshop ""User Interfaces for All""",b39aaf80-0836-5061-afc2-9a04781c5af7
db2,563,Universally accessible Uis: The unified user interface development,ec45401a-3959-5054-b997-2a759d488c01
db2,564,An Accessible Word Processor for Disabled People,55bbf1a0-f279-5ab2-b19b-9891f86fe445
db2,565,Universal Access Issues in Open and Distance Learning.,65e1af06-4d6e-5033-ac5c-2a32f42be164
db2,566,From User Interfaces for All to an Information Society for ALL: challenges and opportunities,416b6cbc-7030-5b84-ad98-8f67610b7b42
db2,567,From Adaptations to User Interfaces for All,5d6cde23-3c0f-5a5f-aa9b-13e491b29d6c
db2,568,From User Interfaces for All to an Information Society for All: Recent achievements and future challenges,fd44cda8-dce6-5922-93bc-82f6e6827669
db2,569,Interactive learning Environment for Children,40266ad1-2548-5497-a63d-2bef5d543123
db2,570,Interactive Leatning Environments for Children,ce48ef88-50b7-55fa-a94d-5c24dc6c0ffb
db2,571,Universally accessible UIs: The unified user interface development,ec45401a-3959-5054-b997-2a759d488c01
db2,572,"Σεμινάριο HCI στο μάθημα ""Ηλέκτρονικός φάκελος ασθενών""",296c131d-600b-5a4e-ba15-15fffe183779
db2,573,"Design for ""all"" in the Information Society",6165091e-f510-5ea4-81d0-6edebdf3a5ef
db2,574,Universal Access to Open Distance Learning,05d83d95-350a-5f7f-94a3-4411689de79a
db2,575,A Grammar-based Approach Supporting Universal Design,e732696d-c8a8-5210-9ea4-9d3f7607cd85
db2,576,Καθολική Πρόσβαση στην Κοινωνία της Πληροφορίας,dcf65cfa-5182-5a9f-9715-a5fcbe609d01
db2,577,Draft Report on standardisation guidelines for the accessibility of Web-based applications and services by people with disabilities,2365b498-8f42-5a68-8cee-e7b9d3ae459a
db2,578,Requirements analysis for the Lexical database User Interfaces,03358543-35cd-551b-930b-e3a37dda3170
db2,579,Scenario Development,fce1dfba-2f6d-52f6-9778-d916aeb1bab7
db2,580,Learner-centred adaptation of interaction courseware,8fde6a45-2dc4-5a98-b704-6da9d417416b
db2,581,*Guy Gobut Report*,4b1f5aeb-16de-59d1-b62c-a31e4c1adf0b
db2,582,Report on Quality Assurance Process,f0d26981-56c8-5b9c-a6c5-83b63438f8d2
db2,583,Report on Data Collection Plan & Instruments,6228834d-da9c-57a2-bef2-109ed26e8dae
db2,584,Project Presentation,088e1624-ccf6-5c8b-846b-659adc4ced90
db2,585,Continuous Interaction through User Interface Adaptation: The AVANTI Scenario,04ce5f5b-b158-5556-bb18-72dbe9a65dfe
db2,586,Αναφορά στην Υλοποίηση και επίδειξη του λειτουργικού κορμού του συστήματος,0a0783c9-51a5-5b6c-808d-b7a85d356d11
db2,587,Αναφορά και επίδειξη της εγκατάστασης του Συστήματος,d7981d1a-eeae-5bff-8344-ff4cad78b745
db2,588,Αναφορά στην υλοποίηση και επίδειξη της ενοποιημένης διεπιφάνειας χρήσης και της ολοκλήρωσης της εφαρμογής,a0c39c11-613e-5bd8-905e-851546126ecd
db2,589,Αναφορά στην αξιολόγηση του ενοποιημένου συστήματος πλοήγησης στον παγκόσμιο ιστό,725e12b8-2e6b-58c1-8d2a-e73ca689e8d3
db2,590,Εφαρμογή Όργάνωσης Περιεχομένου σε CD,5d88d77e-4830-5af7-aca0-fdc025c56453
db2,591,Τεχνική αναφορά για την λειτουργία του ΔΙΑΛΕΞΙΚΟ στο Διαδίκτυο,0ccefa80-7b3f-5ce4-bd30-87931b3d2c54
db2,592,Δοκιμαστική Λειτουργία και Αξιολόγηση της Εφαρμογής Πρόσβασης στη ΛΒΔ μέσω του Παγκόσμιου Ιστού,d56d7316-6bc6-5ca7-8227-3d3d88fcc6e3
db2,594,Interacting with the Disappearing Computer: Evaluation of the Voyager Development Framework,73719dc7-d226-5b04-bf50-d00b5ae3faa9
db2,595,MENTOR: An Interactive Design Environment for automatic User Interface Adaptation,cfd8a094-2507-56a1-aa7b-12101c769a1a
db2,596,Interacting with the Disappearing Computer: Evaluation of the Voyager Development Framework,73719dc7-d226-5b04-bf50-d00b5ae3faa9
